ticket_id,product,priority,status,short_description,description,closed_notes
TKT-00500,PowerBI,P3,Closed,Need assistance with attachment delete,Need assistance with attachment delete. This is impacting team collaboration.,Deployed fix. Issue no longer occurring.
TKT-00501,PowerBI,P2,Closed,collaborate error when trying to delete,collaborate error when trying to delete. User reports file denied affecting productivity.,Applied fix. Issue no longer occurring.
TKT-00502,Excel,P4,Closed,User unable to unlock due to problem two-factor,User unable to unlock due to problem two-factor. User reports locked problem affecting productivity.,Resolved by reconfiguring two-factor. User confirmed fixed.
TKT-00503,Email,P4,Closed,Request access to permission in Email,Request access to permission in Email. User reports folder missing affecting productivity.,Applied fix. Issue no longer occurring.
TKT-00504,PowerBI,P3,Closed,Need replacement hardware,Need replacement hardware. This is impacting daily workflow.,Resolved peripheral damaged. Tested successfully with user.
TKT-00505,Email,P1,Closed,calendar not delete properly,calendar not delete properly. User has tried clearing cache without success.,Resolved appointment permissions. Tested successfully with user.
TKT-00506,PowerBI,P1,Closed,Intermittent connection timeout,Intermittent connection timeout. User reports connectivity blocked affecting productivity.,Resolved by updating connection. User confirmed fixed.
TKT-00507,Email,P4,Closed,export outdated in Email,export outdated in Email. User reports visualization outdated affecting productivity.,Applied update. Issue no longer occurring.
TKT-00508,Excel,P2,Closed,Excel performance and problem,Excel performance and problem. Error occurs when attempting to typing.  also affected.,Implemented configuration change. Issue no longer occurring.
TKT-00509,Email,P1,Closed,Request access to share in Email,Request access to share in Email. User has tried updating without success.,Resolved by reconfiguring share. User confirmed working.
TKT-00510,SharePoint,P4,Closed,SharePoint loading when searching,SharePoint loading when searching. This is impacting team collaboration.,Deployed update. Issue no longer occurring.
TKT-00511,Email,P3,Closed,disconnect failure affecting Email access,disconnect failure affecting Email access. Error occurs when attempting to connect. connectivity also affected.,Applied patch. Issue no longer occurring.
TKT-00512,Email,P1,Closed,Permission denied when share access,Permission denied when share access. Error occurs when attempting to access. upload also affected.,Resolved by updating access. User confirmed resolved.
TKT-00513,Smartsheet,P1,Closed,Smartsheet lag when scrolling,Smartsheet lag when scrolling. This is impacting daily workflow.,Resolved by reconfiguring lag. User confirmed resolved.
TKT-00514,Outlook,P3,Closed,Issue with out-of-office delivery,Issue with out-of-office delivery. User has tried updating without success.,Resolved by reconfiguring out-of-office. User confirmed working.
TKT-00515,Teams,P1,Closed,denied missing when trying to upload,denied missing when trying to upload. This is impacting project deadlines.,Escalated to tier 2. Resolution: sync updated.
TKT-00516,Smartsheet,P2,Closed,Application hang during normal use,Application hang during normal use. User has tried reinstalling without success.,Implemented configuration change. Issue no longer occurring.
TKT-00517,Excel,P4,Closed,activation compatibility when attempting install,activation compatibility when attempting install. User has tried clearing cache without success.,Corrected update error. Tested successfully with user.
TKT-00518,Email,P2,Closed,Cannot view email in Email,Cannot view email in Email. User has tried clearing cache without success.,Implemented update. Issue no longer occurring.
TKT-00519,Smartsheet,P2,Closed,Permission denied when delete file,Permission denied when delete file. User has tried updating without success.,Escalated to specialist team. Resolution: file replaced.
TKT-00520,SharePoint,P3,Closed,Need help with account problem,Need help with account problem. This is impacting daily workflow.,Fixed account locked. Tested successfully with user.
TKT-00521,Email,P4,Closed,expired problem preventing access to Email,expired problem preventing access to Email. Error occurs when attempting to reset. login also affected.,Escalated to specialist team. Resolution: expired replaced.
TKT-00522,SharePoint,P2,Closed,expired issue preventing access to SharePoint,expired issue preventing access to SharePoint. User reports expired failure affecting productivity.,Escalated to vendor support. Resolution: login replaced.
TKT-00523,OneDrive,P2,Closed,OneDrive timeout when searching,OneDrive timeout when searching. This is impacting team collaboration.,Deployed patch. Issue no longer occurring.
TKT-00524,Smartsheet,P1,Closed,Smartsheet unavailable due to connection problem,Smartsheet unavailable due to connection problem. Error occurs when attempting to establish. firewall also affected.,Corrected latency failure. Tested successfully with user.
TKT-00525,Teams,P1,Closed,Teams freeze and performance,Teams freeze and performance. User reports unresponsive performance affecting productivity.,Escalated to vendor support. Resolution: hang replaced.
TKT-00526,Excel,P3,Closed,Excel loading when saving,Excel loading when saving. User has tried restarting without success.,Resolved by updating loading. User confirmed fixed.
TKT-00527,OneDrive,P2,Closed,OneDrive timeout when searching,OneDrive timeout when searching. This is impacting project deadlines.,Escalated to specialist team. Resolution: timeout updated.
TKT-00528,Outlook,P4,Closed,Request to login reset for user account,Request to login reset for user account. User has tried reinstalling without success.,Resolved by reinstalling reset. User confirmed working.
TKT-00529,SharePoint,P3,Closed,User unable to access due to locked password,User unable to access due to locked password. User reports two-factor issue affecting productivity.,Corrected login issue. Tested successfully with user.
TKT-00530,Smartsheet,P2,Closed,Smartsheet unavailable due to network problem,Smartsheet unavailable due to network problem. User reports offline failure affecting productivity.,Fixed offline dropped. Tested successfully with user.
TKT-00531,SharePoint,P4,Closed,Request to unlock MFA for user account,Request to unlock MFA for user account. User reports two-factor locked affecting productivity.,Resolved by reinstalling MFA. User confirmed working.
TKT-00532,SharePoint,P3,Closed,Issue with receive delivery,Issue with receive delivery. User reports email loading affecting productivity.,Implemented fix. Issue no longer occurring.
TKT-00533,OneDrive,P1,Closed,password problem preventing access to OneDrive,password problem preventing access to OneDrive. User has tried restarting without success.,Escalated to specialist team. Resolution: password replaced.
TKT-00534,SharePoint,P1,Closed,printer failure requiring support,printer failure requiring support. Error occurs when attempting to functioning. dock and display also affected.,Resolved by reconfiguring printer. User confirmed resolved.
TKT-00535,SharePoint,P1,Closed,Unable to upload share in SharePoint,Unable to upload share in SharePoint. This is impacting team collaboration.,Escalated to tier 2. Resolution: document reconfigured.
TKT-00536,SharePoint,P1,Closed,Need assistance with delegate view,Need assistance with delegate view. User has tried updating without success.,Resolved receive synchronization. Tested successfully with user.
TKT-00537,OneDrive,P3,Closed,OneDrive crash and problem,OneDrive crash and problem. Error occurs when attempting to opening. unresponsive and delay and timeout also affected.,Resolved by reconfiguring crash. User confirmed working.
TKT-00538,SharePoint,P4,Closed,installation issue when attempting install,installation issue when attempting install. User has tried clearing cache without success.,Fixed software problem. Tested successfully with user.
TKT-00539,Smartsheet,P2,Closed,Cannot receive inbox in Smartsheet,Cannot receive inbox in Smartsheet. Error occurs when attempting to receive. sync and appointment and email also affected.,Resolved by reinstalling inbox. User confirmed resolved.
TKT-00540,Email,P4,Closed,download error when trying to upload,download error when trying to upload. User has tried restarting without success.,Resolved by resetting download. User confirmed working.
TKT-00541,Smartsheet,P4,Closed,Cannot connect due to disconnect timeout,Cannot connect due to disconnect timeout. Error occurs when attempting to access. connectivity also affected.,Corrected latency unstable. Tested successfully with user.
TKT-00542,Outlook,P4,Closed,two-factor expired preventing access to Outlook,two-factor expired preventing access to Outlook. User reports reset locked affecting productivity.,Resolved by resetting two-factor. User confirmed resolved.
TKT-00543,Teams,P1,Closed,Teams delay and behavior,Teams delay and behavior. User reports freeze behavior affecting productivity.,Resolved by reconfiguring delay. User confirmed resolved.
TKT-00544,Email,P2,Closed,export not generate correctly,export not generate correctly. Error occurs when attempting to export. dataset also affected.,Resolved dataset incomplete. Tested successfully with user.
TKT-00545,Email,P4,Closed,Android error with Email,Android error with Email. Error occurs when attempting to access. phone also affected.,Escalated to tier 2. Resolution: remote updated.
TKT-00546,Teams,P1,Closed,meeting not forward properly,meeting not forward properly. User has tried restarting without success.,Applied patch. Issue no longer occurring.
TKT-00547,Smartsheet,P4,Closed,Unable to share folder in Smartsheet,Unable to share folder in Smartsheet. Error occurs when attempting to edit. document also affected.,Fixed sync error. Tested successfully with user.
TKT-00548,OneDrive,P4,Closed,VPN error affecting OneDrive access,VPN error affecting OneDrive access. This is impacting project deadlines.,Resolved by resetting VPN. User confirmed working.
TKT-00549,OneDrive,P4,Closed,Cannot sync out-of-office in OneDrive,Cannot sync out-of-office in OneDrive. User has tried clearing cache without success.,Escalated to tier 2. Resolution: email reconfigured.
TKT-00550,Outlook,P1,Closed,Need help with MFA problem,Need help with MFA problem. This is impacting daily workflow.,Escalated to specialist team. Resolution: credential updated.
TKT-00551,Excel,P3,Closed,Request access to access in Excel,Request access to access in Excel. Error occurs when attempting to move. download and document also affected.,Escalated to specialist team. Resolution: file updated.
TKT-00552,Excel,P3,Closed,Cannot sync out-of-office in Excel,Cannot sync out-of-office in Excel. User has tried reinstalling without success.,Resolved by reconfiguring out-of-office. User confirmed working.
TKT-00553,PowerBI,P4,Closed,permission failure when trying to move,permission failure when trying to move. Error occurs when attempting to delete. file also affected.,Resolved by resetting permission. User confirmed working.
TKT-00554,Excel,P3,Closed,Cannot connect due to network dropped,Cannot connect due to network dropped. This is impacting daily workflow.,Deployed update. Issue no longer occurring.
TKT-00555,OneDrive,P1,Closed,Need assistance with calendar sync,Need assistance with calendar sync. User reports delegate display affecting productivity.,Escalated to specialist team. Resolution: receive updated.
TKT-00556,OneDrive,P3,Closed,Request access to document in OneDrive,Request access to document in OneDrive. User reports denied missing affecting productivity.,Applied patch. Issue no longer occurring.
TKT-00557,Email,P4,Closed,out-of-office not send properly,out-of-office not send properly. User reports inbox delivery affecting productivity.,Resolved out-of-office loading. Tested successfully with user.
TKT-00558,Excel,P3,Closed,Cannot connect due to bandwidth error,Cannot connect due to bandwidth error. This is impacting client communication.,Resolved by updating bandwidth. User confirmed fixed.
TKT-00559,SharePoint,P2,Closed,Permission denied when access download,Permission denied when access download. User has tried clearing cache without success.,Resolved by reconfiguring download. User confirmed fixed.
TKT-00560,Outlook,P4,Closed,denied error when trying to share,denied error when trying to share. This is impacting daily workflow.,Deployed update. Issue no longer occurring.
TKT-00561,Excel,P3,Closed,Need assistance with meeting forward,Need assistance with meeting forward. Error occurs when attempting to view. sync also affected.,Resolved by resetting meeting. User confirmed fixed.
TKT-00562,PowerBI,P3,Closed,receive not forward properly,receive not forward properly. User has tried reinstalling without success.,Resolved by resetting receive. User confirmed fixed.
TKT-00563,Excel,P3,Closed,Issue with appointment loading,Issue with appointment loading. User reports appointment delivery affecting productivity.,Escalated to tier 2. Resolution: receive replaced.
TKT-00564,PowerBI,P3,Closed,share failure when trying to move,share failure when trying to move. User reports document failure affecting productivity.,Fixed upload corrupted. Tested successfully with user.
TKT-00565,Teams,P1,Closed,chart not create correctly,chart not create correctly. User has tried updating without success.,Escalated to vendor support. Resolution: visualization reconfigured.
TKT-00566,OneDrive,P1,Closed,Unable to upload folder in OneDrive,Unable to upload folder in OneDrive. Error occurs when attempting to download. permission and collaborate also affected.,Applied configuration change. Issue no longer occurring.
TKT-00567,PowerBI,P1,Closed,Experiencing freeze issue with PowerBI,Experiencing freeze issue with PowerBI. User reports delay problem affecting productivity.,Applied fix. Issue no longer occurring.
TKT-00568,Smartsheet,P2,Closed,Need best practice on how to setup in Smartsheet,Need best practice on how to setup in Smartsheet. User has tried updating without success.,Resolved documentation question. Tested successfully with user.
TKT-00569,SharePoint,P2,Closed,Request to unlock two-factor for user account,Request to unlock two-factor for user account. User has tried clearing cache without success.,Applied fix. Issue no longer occurring.
TKT-00570,Email,P3,Closed,Email unavailable due to latency problem,Email unavailable due to latency problem. This is impacting daily workflow.,Implemented update. Issue no longer occurring.
TKT-00571,Excel,P3,Closed,installation issue when attempting install,installation issue when attempting install. This is impacting daily workflow.,Resolved by reinstalling installation. User confirmed working.
TKT-00572,Excel,P2,Closed,Request access to permission in Excel,Request access to permission in Excel. User has tried clearing cache without success.,Deployed patch. Issue no longer occurring.
TKT-00573,Excel,P4,Closed,Request patch deploy assistance,Request patch deploy assistance. This is impacting daily workflow.,Applied patch. Issue no longer occurring.
TKT-00574,Outlook,P1,Closed,Request to unlock reset for user account,Request to unlock reset for user account. User reports two-factor expired affecting productivity.,Resolved by updating reset. User confirmed fixed.
TKT-00575,OneDrive,P2,Closed,Unable to access access in OneDrive,Unable to access access in OneDrive. User has tried clearing cache without success.,Corrected upload denied. Tested successfully with user.
TKT-00576,Teams,P2,Closed,appointment not forward properly,appointment not forward properly. This is impacting team collaboration.,Escalated to specialist team. Resolution: out-of-office updated.
TKT-00577,SharePoint,P4,Closed,upload error when trying to edit,upload error when trying to edit. This is impacting daily workflow.,Resolved by resetting upload. User confirmed resolved.
TKT-00578,Email,P2,Closed,Unable to upload sync in Email,Unable to upload sync in Email. This is impacting daily workflow.,Corrected share missing. Tested successfully with user.
TKT-00579,OneDrive,P2,Closed,Need replacement keyboard,Need replacement keyboard. User reports printer broken affecting productivity.,Deployed update. Issue no longer occurring.
TKT-00580,Email,P2,Closed,User unable to authenticate due to issue unlock,User unable to authenticate due to issue unlock. Error occurs when attempting to login. credential also affected.,Deployed patch. Issue no longer occurring.
TKT-00581,PowerBI,P3,Closed,permission error when trying to upload,permission error when trying to upload. This is impacting daily workflow.,Fixed file failure. Tested successfully with user.
TKT-00582,SharePoint,P3,Closed,Permission denied when share download,Permission denied when share download. User reports folder error affecting productivity.,Fixed share missing. Tested successfully with user.
TKT-00583,Teams,P1,Closed,issue during install process,issue during install process. This is impacting team collaboration.,Escalated to vendor support. Resolution: software replaced.
TKT-00584,Email,P2,Closed,Issue with calendar permissions,Issue with calendar permissions. User has tried updating without success.,Applied patch. Issue no longer occurring.
TKT-00585,OneDrive,P2,Closed,Need assistance with out-of-office forward,Need assistance with out-of-office forward. This is impacting team collaboration.,Resolved by reconfiguring out-of-office. User confirmed resolved.
TKT-00586,PowerBI,P1,Closed,Issue with inbox delivery,Issue with inbox delivery. User has tried reinstalling without success.,Escalated to vendor support. Resolution: delegate replaced.
TKT-00587,Smartsheet,P4,Closed,Unable to move document in Smartsheet,Unable to move document in Smartsheet. Error occurs when attempting to edit. folder also affected.,Resolved by reinstalling document. User confirmed working.
TKT-00588,Teams,P3,Closed,display broken requiring support,display broken requiring support. User reports peripheral failure affecting productivity.,Implemented update. Issue no longer occurring.
TKT-00589,SharePoint,P1,Closed,meeting not receive properly,meeting not receive properly. User has tried restarting without success.,Applied patch. Issue no longer occurring.
TKT-00590,SharePoint,P1,Closed,login problem preventing access to SharePoint,login problem preventing access to SharePoint. This is impacting project deadlines.,Resolved by updating login. User confirmed working.
TKT-00591,Email,P2,Closed,Request access to sync in Email,Request access to sync in Email. User has tried reinstalling without success.,Escalated to vendor support. Resolution: document replaced.
TKT-00592,PowerBI,P1,Closed,Unable to edit document in PowerBI,Unable to edit document in PowerBI. This is impacting daily workflow.,Escalated to tier 2. Resolution: upload updated.
TKT-00593,Excel,P2,Closed,Need help with authentication expired,Need help with authentication expired. User has tried clearing cache without success.,Deployed fix. Issue no longer occurring.
TKT-00594,Teams,P4,Closed,Experiencing timeout issue with Teams,Experiencing timeout issue with Teams. This is impacting daily workflow.,Escalated to specialist team. Resolution: unresponsive reconfigured.
TKT-00595,Teams,P3,Closed,connectivity timeout affecting Teams access,connectivity timeout affecting Teams access. This is impacting team collaboration.,Escalated to tier 2. Resolution: bandwidth reconfigured.
TKT-00596,Email,P2,Closed,offline dropped affecting Email access,offline dropped affecting Email access. User has tried restarting without success.,Escalated to vendor support. Resolution: timeout replaced.
TKT-00597,Smartsheet,P2,Closed,failure during version process,failure during version process. User reports installation problem affecting productivity.,Deployed configuration change. Issue no longer occurring.
TKT-00598,Email,P4,Closed,Intermittent VPN unstable,Intermittent VPN unstable. User reports latency unstable affecting productivity.,Escalated to vendor support. Resolution: latency updated.
TKT-00599,Teams,P1,Closed,Need assistance with delegate access,Need assistance with delegate access. Error occurs when attempting to receive. email also affected.,Applied update. Issue no longer occurring.
TKT-00600,OneDrive,P3,Closed,Request update update assistance,Request update update assistance. User has tried reinstalling without success.,Escalated to specialist team. Resolution: license updated.
TKT-00601,PowerBI,P1,Closed,Issue with delegate delivery,Issue with delegate delivery. This is impacting client communication.,Fixed inbox delivery. Tested successfully with user.
TKT-00602,Email,P2,Closed,Unable to download folder in Email,Unable to download folder in Email. This is impacting daily workflow.,Escalated to tier 2. Resolution: sync updated.
TKT-00603,SharePoint,P3,Closed,Cannot delete send in SharePoint,Cannot delete send in SharePoint. This is impacting team collaboration.,Escalated to tier 2. Resolution: send updated.
TKT-00604,OneDrive,P3,Closed,Cannot login OneDrive on app device,Cannot login OneDrive on app device. User reports tablet failure affecting productivity.,Corrected app problem. Tested successfully with user.
TKT-00605,Email,P3,Closed,Request access to file in Email,Request access to file in Email. Error occurs when attempting to edit. access and folder also affected.,Applied fix. Issue no longer occurring.
TKT-00606,PowerBI,P4,Closed,activation error when attempting install,activation error when attempting install. This is impacting project deadlines.,Applied fix. Issue no longer occurring.
TKT-00607,OneDrive,P2,Closed,Request to login password for user account,Request to login password for user account. User reports locked issue affecting productivity.,Applied fix. Issue no longer occurring.
TKT-00608,Outlook,P4,Closed,login failure preventing access to Outlook,login failure preventing access to Outlook. This is impacting project deadlines.,Resolved by reinstalling login. User confirmed resolved.
TKT-00609,PowerBI,P3,Closed,Need replacement charger,Need replacement charger. User reports printer malfunction affecting productivity.,Deployed update. Issue no longer occurring.
TKT-00610,Smartsheet,P4,Closed,Issue with receive display,Issue with receive display. This is impacting daily workflow.,Resolved by resetting receive. User confirmed working.
TKT-00611,PowerBI,P2,Closed,patch failure when attempting update,patch failure when attempting update. This is impacting client communication.,Deployed configuration change. Issue no longer occurring.
TKT-00612,Outlook,P3,Closed,Outlook unresponsive and issue,Outlook unresponsive and issue. This is impacting project deadlines.,Resolved by updating unresponsive. User confirmed fixed.
TKT-00613,SharePoint,P1,Closed,Cannot send sync in SharePoint,Cannot send sync in SharePoint. Error occurs when attempting to delete. attachment and calendar also affected.,Escalated to specialist team. Resolution: appointment updated.
TKT-00614,Smartsheet,P3,Closed,Unable to delete folder in Smartsheet,Unable to delete folder in Smartsheet. User reports document missing affecting productivity.,Deployed fix. Issue no longer occurring.
TKT-00615,PowerBI,P4,Closed,Need to update software for PowerBI,Need to update software for PowerBI. User has tried reinstalling without success.,Resolved by reconfiguring software. User confirmed working.
TKT-00616,Email,P3,Closed,Request to access credential for user account,Request to access credential for user account. User has tried clearing cache without success.,Escalated to tier 2. Resolution: account replaced.
TKT-00617,SharePoint,P3,Closed,Request access to denied in SharePoint,Request access to denied in SharePoint. User has tried clearing cache without success.,Corrected folder corrupted. Tested successfully with user.
TKT-00618,PowerBI,P1,Closed,User unable to access due to problem reset,User unable to access due to problem reset. Error occurs when attempting to reset. account and unlock and MFA also affected.,Resolved by reinstalling reset. User confirmed working.
TKT-00619,OneDrive,P1,Closed,MFA error preventing access to OneDrive,MFA error preventing access to OneDrive. This is impacting client communication.,Escalated to tier 2. Resolution: account reconfigured.
TKT-00620,OneDrive,P2,Closed,Request access to collaborate in OneDrive,Request access to collaborate in OneDrive. Error occurs when attempting to access. denied also affected.,Applied update. Issue no longer occurring.
TKT-00621,Email,P3,Closed,display malfunction requiring support,display malfunction requiring support. Error occurs when attempting to connecting. mouse also affected.,Resolved by updating display. User confirmed working.
TKT-00622,SharePoint,P3,Closed,Request to unlock login for user account,Request to unlock login for user account. This is impacting daily workflow.,Escalated to tier 2. Resolution: password replaced.
TKT-00623,Smartsheet,P2,Closed,tablet app error,tablet app error. This is impacting team collaboration.,Resolved by updating tablet. User confirmed working.
TKT-00624,Smartsheet,P1,Closed,Need assistance with receive sync,Need assistance with receive sync. User has tried reinstalling without success.,Escalated to tier 2. Resolution: email replaced.
TKT-00625,Email,P4,Closed,Unable to share document in Email,Unable to share document in Email. This is impacting team collaboration.,Resolved by reconfiguring document. User confirmed resolved.
TKT-00626,SharePoint,P1,Closed,folder failure when trying to download,folder failure when trying to download. This is impacting project deadlines.,Applied configuration change. Issue no longer occurring.
TKT-00627,Excel,P1,Closed,Cannot send sync in Excel,Cannot send sync in Excel. This is impacting team collaboration.,Deployed update. Issue no longer occurring.
