ticket_id,product,priority,status,short_description,description,closed_notes
TKT-01380,Teams,P4,Closed,dashboard incorrect in Teams,dashboard incorrect in Teams. This is impacting daily workflow.,Escalated to tier 2. Resolution: filter updated.
TKT-01381,Excel,P3,Closed,Request access to file in Excel,Request access to file in Excel. This is impacting project deadlines.,Applied patch. Issue no longer occurring.
TKT-01382,Excel,P3,Closed,inbox not delete properly,inbox not delete properly. Error occurs when attempting to access. calendar also affected.,Deployed configuration change. Issue no longer occurring.
TKT-01383,OneDrive,P4,Closed,upload corrupted when trying to access,upload corrupted when trying to access. User reports file failure affecting productivity.,Resolved download error. Tested successfully with user.
TKT-01384,Excel,P2,Closed,phone failure with Excel,phone failure with Excel. This is impacting daily workflow.,Deployed fix. Issue no longer occurring.
TKT-01385,PowerBI,P4,Closed,PowerBI delay when loading,PowerBI delay when loading. Error occurs when attempting to loading. performance also affected.,Applied patch. Issue no longer occurring.
TKT-01386,Email,P1,Closed,Experiencing hang behavior with Email,Experiencing hang behavior with Email. User has tried reinstalling without success.,Resolved by reconfiguring hang. User confirmed working.
TKT-01387,Excel,P3,Closed,query error in Excel,query error in Excel. User has tried reinstalling without success.,Resolved by resetting query. User confirmed working.
TKT-01388,OneDrive,P1,Closed,Request access to upload in OneDrive,Request access to upload in OneDrive. Error occurs when attempting to download. collaborate also affected.,Resolved by resetting upload. User confirmed resolved.
TKT-01389,Smartsheet,P1,Closed,Seeking guide for new Smartsheet feature,Seeking guide for new Smartsheet feature. Error occurs when attempting to customize. best practice also affected.,Escalated to specialist team. Resolution: documentation reconfigured.
TKT-01390,Email,P3,Closed,Request version activate assistance,Request version activate assistance. Error occurs when attempting to deploy. activation and software also affected.,Resolved by updating version. User confirmed working.
TKT-01391,OneDrive,P4,Closed,Need help with password problem,Need help with password problem. User reports authentication error affecting productivity.,Resolved by reinstalling password. User confirmed fixed.
TKT-01392,Outlook,P2,Closed,Cannot connect due to connection failure,Cannot connect due to connection failure. Error occurs when attempting to maintain. network also affected.,Applied configuration change. Issue no longer occurring.
TKT-01393,Teams,P4,Closed,Intermittent latency timeout,Intermittent latency timeout. This is impacting daily workflow.,Resolved by reconfiguring latency. User confirmed working.
TKT-01394,Teams,P2,Closed,Request access to document in Teams,Request access to document in Teams. Error occurs when attempting to download. denied also affected.,Implemented configuration change. Issue no longer occurring.
TKT-01395,Excel,P3,Closed,Permission denied when download access,Permission denied when download access. User reports file error affecting productivity.,Resolved by resetting access. User confirmed fixed.
TKT-01396,Outlook,P2,Closed,Need assistance with sync send,Need assistance with sync send. User reports delegate display affecting productivity.,Resolved receive delivery. Tested successfully with user.
TKT-01397,Smartsheet,P1,Closed,Permission denied when delete folder,Permission denied when delete folder. Error occurs when attempting to delete. permission also affected.,Escalated to tier 2. Resolution: download reconfigured.
TKT-01398,PowerBI,P3,Closed,Cannot forward meeting in PowerBI,Cannot forward meeting in PowerBI. User reports sync loading affecting productivity.,Resolved by resetting meeting. User confirmed fixed.
TKT-01399,OneDrive,P2,Closed,Need help with password issue,Need help with password issue. Error occurs when attempting to reset. locked also affected.,Corrected reset locked. Tested successfully with user.
TKT-01400,OneDrive,P3,Closed,Cannot connect due to network blocked,Cannot connect due to network blocked. Error occurs when attempting to access. connection also affected.,Deployed patch. Issue no longer occurring.
TKT-01401,Outlook,P3,Closed,Experiencing performance problem with Outlook,Experiencing performance problem with Outlook. This is impacting project deadlines.,Corrected unresponsive issue. Tested successfully with user.
TKT-01402,PowerBI,P4,Closed,hardware not displaying properly,hardware not displaying properly. User reports dock defective affecting productivity.,Escalated to tier 2. Resolution: laptop reconfigured.
TKT-01403,Smartsheet,P3,Closed,Need help share chart,Need help share chart. User reports dashboard incorrect affecting productivity.,Deployed update. Issue no longer occurring.
TKT-01404,Teams,P2,Closed,User unable to authenticate due to issue credential,User unable to authenticate due to issue credential. User reports unlock failure affecting productivity.,Resolved two-factor expired. Tested successfully with user.
TKT-01405,OneDrive,P2,Closed,Application hang during normal use,Application hang during normal use. User has tried reinstalling without success.,Escalated to vendor support. Resolution: crash replaced.
TKT-01406,Teams,P3,Closed,Issue with email permissions,Issue with email permissions. This is impacting client communication.,Resolved by reinstalling email. User confirmed fixed.
TKT-01407,Outlook,P3,Closed,Issue with inbox delivery,Issue with inbox delivery. User has tried reinstalling without success.,Corrected send loading. Tested successfully with user.
TKT-01408,Excel,P3,Closed,Request access to upload in Excel,Request access to upload in Excel. User reports file missing affecting productivity.,Corrected sync error. Tested successfully with user.
TKT-01409,Teams,P1,Closed,failure during installation process,failure during installation process. This is impacting client communication.,Resolved by reinstalling installation. User confirmed working.
TKT-01410,OneDrive,P4,Closed,Unable to edit folder in OneDrive,Unable to edit folder in OneDrive. User has tried reinstalling without success.,Deployed update. Issue no longer occurring.
TKT-01411,SharePoint,P2,Closed,Cannot sync out-of-office in SharePoint,Cannot sync out-of-office in SharePoint. User has tried clearing cache without success.,Implemented fix. Issue no longer occurring.
TKT-01412,PowerBI,P4,Closed,Need help with reset issue,Need help with reset issue. User reports credential expired affecting productivity.,Resolved by reinstalling reset. User confirmed working.
TKT-01413,PowerBI,P4,Closed,Issue with meeting permissions,Issue with meeting permissions. Error occurs when attempting to forward. email also affected.,Applied patch. Issue no longer occurring.
TKT-01414,PowerBI,P1,Closed,PowerBI timeout when searching,PowerBI timeout when searching. Error occurs when attempting to saving.  also affected.,Resolved by reconfiguring timeout. User confirmed fixed.
TKT-01415,OneDrive,P1,Closed,Request to unlock unlock for user account,Request to unlock unlock for user account. Error occurs when attempting to login. credential and password also affected.,Resolved by reconfiguring unlock. User confirmed resolved.
TKT-01416,Smartsheet,P3,Closed,Smartsheet not open on mobile,Smartsheet not open on mobile. Error occurs when attempting to open. remote and Android also affected.,Applied fix. Issue no longer occurring.
TKT-01417,Excel,P4,Closed,Issue with attachment display,Issue with attachment display. Error occurs when attempting to send. sync and receive also affected.,Applied patch. Issue no longer occurring.
TKT-01418,Excel,P4,Closed,Issue with receive loading,Issue with receive loading. Error occurs when attempting to receive. attachment and sync also affected.,Escalated to specialist team. Resolution: attachment reconfigured.
TKT-01419,Email,P1,Closed,Request to login expired for user account,Request to login expired for user account. Error occurs when attempting to unlock. locked and credential and two-factor also affected.,Resolved by resetting expired. User confirmed fixed.
TKT-01420,Email,P3,Closed,Request setup for Email setup,Request setup for Email setup. User has tried reinstalling without success.,Deployed fix. Issue no longer occurring.
TKT-01421,Excel,P2,Closed,Permission denied when share sync,Permission denied when share sync. This is impacting project deadlines.,Resolved by reinstalling sync. User confirmed resolved.
TKT-01422,PowerBI,P2,Closed,authentication failure preventing access to PowerBI,authentication failure preventing access to PowerBI. User has tried reinstalling without success.,Resolved by updating authentication. User confirmed resolved.
TKT-01423,Email,P2,Closed,Need to activate version for Email,Need to activate version for Email. User has tried updating without success.,Escalated to vendor support. Resolution: application replaced.
TKT-01424,Outlook,P2,Closed,Outlook freeze when opening,Outlook freeze when opening. This is impacting project deadlines.,Resolved unresponsive performance. Tested successfully with user.
TKT-01425,Smartsheet,P2,Closed,mobile app problem,mobile app problem. User has tried clearing cache without success.,Fixed offline error. Tested successfully with user.
TKT-01426,Outlook,P4,Closed,Request to unlock unlock for user account,Request to unlock unlock for user account. Error occurs when attempting to access. locked also affected.,Deployed update. Issue no longer occurring.
TKT-01427,PowerBI,P3,Closed,Cannot create chart from PowerBI,Cannot create chart from PowerBI. This is impacting team collaboration.,Corrected refresh missing. Tested successfully with user.
TKT-01428,OneDrive,P3,Closed,connectivity timeout affecting OneDrive access,connectivity timeout affecting OneDrive access. Error occurs when attempting to establish. network and firewall and offline also affected.,Escalated to specialist team. Resolution: disconnect replaced.
TKT-01429,Teams,P2,Closed,Seeking documentation for new Teams feature,Seeking documentation for new Teams feature. User has tried updating without success.,Resolved by updating documentation. User confirmed fixed.
TKT-01430,SharePoint,P3,Closed,Request access to file in SharePoint,Request access to file in SharePoint. User has tried restarting without success.,Corrected folder missing. Tested successfully with user.
TKT-01431,OneDrive,P3,Closed,access denied when trying to delete,access denied when trying to delete. User reports download error affecting productivity.,Resolved by reinstalling access. User confirmed resolved.
TKT-01432,Outlook,P4,Closed,Cannot receive sync in Outlook,Cannot receive sync in Outlook. User reports delegate permissions affecting productivity.,Applied fix. Issue no longer occurring.
TKT-01433,Teams,P4,Closed,Permission denied when delete denied,Permission denied when delete denied. User has tried clearing cache without success.,Resolved sync denied. Tested successfully with user.
TKT-01434,Excel,P1,Closed,Unable to delete file in Excel,Unable to delete file in Excel. User reports document error affecting productivity.,Resolved by reconfiguring file. User confirmed fixed.
TKT-01435,PowerBI,P1,Closed,Cannot send inbox in PowerBI,Cannot send inbox in PowerBI. User reports appointment display affecting productivity.,Escalated to specialist team. Resolution: calendar updated.
TKT-01436,SharePoint,P1,Closed,monitor not responding properly,monitor not responding properly. User reports mouse failure affecting productivity.,Resolved by updating monitor. User confirmed resolved.
TKT-01437,Teams,P2,Closed,Teams crash when searching,Teams crash when searching. User reports freeze problem affecting productivity.,Resolved by resetting crash. User confirmed working.
TKT-01438,Outlook,P4,Closed,Experiencing loading performance with Outlook,Experiencing loading performance with Outlook. Error occurs when attempting to saving. delay also affected.,Resolved by reconfiguring loading. User confirmed working.
TKT-01439,OneDrive,P1,Closed,Need assistance with out-of-office send,Need assistance with out-of-office send. This is impacting daily workflow.,Implemented update. Issue no longer occurring.
TKT-01440,Excel,P2,Closed,Request upgrade install assistance,Request upgrade install assistance. User has tried reinstalling without success.,Corrected installation error. Tested successfully with user.
TKT-01441,Outlook,P3,Closed,How to use help in Outlook,How to use help in Outlook. User has tried updating without success.,Implemented update. Issue no longer occurring.
TKT-01442,Outlook,P3,Closed,refresh missing in Outlook,refresh missing in Outlook. User has tried restarting without success.,Resolved by reinstalling refresh. User confirmed fixed.
TKT-01443,PowerBI,P2,Closed,Permission denied when share denied,Permission denied when share denied. User has tried clearing cache without success.,Resolved by reinstalling denied. User confirmed resolved.
TKT-01444,PowerBI,P3,Closed,Permission denied when share access,Permission denied when share access. Error occurs when attempting to delete. share and permission also affected.,Implemented configuration change. Issue no longer occurring.
TKT-01445,OneDrive,P3,Closed,Issue with delegate delivery,Issue with delegate delivery. Error occurs when attempting to view. meeting and sync also affected.,Fixed out-of-office display. Tested successfully with user.
TKT-01446,Outlook,P3,Closed,Permission denied when edit document,Permission denied when edit document. Error occurs when attempting to download. file also affected.,Corrected permission denied. Tested successfully with user.
TKT-01447,Smartsheet,P2,Closed,Request access to sync in Smartsheet,Request access to sync in Smartsheet. This is impacting project deadlines.,Corrected upload failure. Tested successfully with user.
TKT-01448,Outlook,P4,Closed,meeting not receive properly,meeting not receive properly. Error occurs when attempting to delete. send and delegate also affected.,Implemented patch. Issue no longer occurring.
TKT-01449,OneDrive,P4,Closed,denied error when trying to share,denied error when trying to share. User has tried updating without success.,Deployed fix. Issue no longer occurring.
TKT-01450,PowerBI,P2,Closed,Request access to download in PowerBI,Request access to download in PowerBI. User reports access missing affecting productivity.,Deployed update. Issue no longer occurring.
TKT-01451,OneDrive,P2,Closed,Permission denied when move denied,Permission denied when move denied. Error occurs when attempting to download. download and upload and file also affected.,Escalated to vendor support. Resolution: denied updated.
TKT-01452,Email,P2,Closed,Need help with two-factor error,Need help with two-factor error. This is impacting daily workflow.,Deployed patch. Issue no longer occurring.
TKT-01453,Excel,P4,Closed,expired issue preventing access to Excel,expired issue preventing access to Excel. User reports expired locked affecting productivity.,Resolved by reconfiguring expired. User confirmed working.
TKT-01454,PowerBI,P4,Closed,Need help with account failure,Need help with account failure. User reports MFA error affecting productivity.,Escalated to specialist team. Resolution: locked updated.
TKT-01455,Email,P3,Closed,Cannot open Email on remote device,Cannot open Email on remote device. Error occurs when attempting to update. mobile also affected.,Resolved by updating remote. User confirmed working.
TKT-01456,Outlook,P4,Closed,Issue with inbox synchronization,Issue with inbox synchronization. User has tried updating without success.,Fixed attachment delivery. Tested successfully with user.
TKT-01457,PowerBI,P1,Closed,Intermittent timeout blocked,Intermittent timeout blocked. This is impacting project deadlines.,Resolved by resetting timeout. User confirmed working.
TKT-01458,SharePoint,P2,Closed,Request access to access in SharePoint,Request access to access in SharePoint. User has tried restarting without success.,Resolved sync corrupted. Tested successfully with user.
TKT-01459,PowerBI,P2,Closed,Need to configure update for PowerBI,Need to configure update for PowerBI. Error occurs when attempting to configure. version also affected.,Corrected version failure. Tested successfully with user.
TKT-01460,Excel,P4,Closed,access corrupted when trying to share,access corrupted when trying to share. Error occurs when attempting to access. collaborate also affected.,Resolved share corrupted. Tested successfully with user.
TKT-01461,SharePoint,P2,Closed,Need assistance with out-of-office access,Need assistance with out-of-office access. User has tried restarting without success.,Escalated to specialist team. Resolution: attachment updated.
TKT-01462,Email,P4,Closed,Need assistance with calendar sync,Need assistance with calendar sync. Error occurs when attempting to send. inbox also affected.,Implemented configuration change. Issue no longer occurring.
TKT-01463,Smartsheet,P2,Closed,User unable to access due to locked unlock,User unable to access due to locked unlock. User reports unlock issue affecting productivity.,Deployed patch. Issue no longer occurring.
TKT-01464,PowerBI,P2,Closed,Need help with MFA problem,Need help with MFA problem. User reports password error affecting productivity.,Fixed locked expired. Tested successfully with user.
TKT-01465,Smartsheet,P2,Closed,mouse broken requiring support,mouse broken requiring support. This is impacting daily workflow.,Fixed laptop broken. Tested successfully with user.
TKT-01466,Excel,P4,Closed,software error when attempting activate,software error when attempting activate. This is impacting daily workflow.,Resolved by updating software. User confirmed resolved.
TKT-01467,SharePoint,P2,Closed,Unable to upload denied in SharePoint,Unable to upload denied in SharePoint. Error occurs when attempting to download. file and upload and sync also affected.,Applied configuration change. Issue no longer occurring.
TKT-01468,OneDrive,P1,Closed,network failure affecting OneDrive access,network failure affecting OneDrive access. This is impacting client communication.,Fixed network timeout. Tested successfully with user.
TKT-01469,Email,P1,Closed,Request access to upload in Email,Request access to upload in Email. User has tried clearing cache without success.,Escalated to tier 2. Resolution: download updated.
TKT-01470,Teams,P4,Closed,Request patch activate assistance,Request patch activate assistance. Error occurs when attempting to deploy. upgrade also affected.,Implemented fix. Issue no longer occurring.
TKT-01471,Email,P4,Closed,Need help with credential problem,Need help with credential problem. User reports account error affecting productivity.,Implemented patch. Issue no longer occurring.
TKT-01472,Smartsheet,P2,Closed,failure during upgrade process,failure during upgrade process. User has tried updating without success.,Applied update. Issue no longer occurring.
TKT-01473,PowerBI,P2,Closed,laptop not responding properly,laptop not responding properly. This is impacting client communication.,Resolved charger failure. Tested successfully with user.
TKT-01474,OneDrive,P3,Closed,Unable to access denied in OneDrive,Unable to access denied in OneDrive. This is impacting daily workflow.,Resolved download missing. Tested successfully with user.
TKT-01475,SharePoint,P2,Closed,Request to access unlock for user account,Request to access unlock for user account. This is impacting team collaboration.,Escalated to tier 2. Resolution: password replaced.
TKT-01476,Email,P4,Closed,install error when attempting deploy,install error when attempting deploy. User reports license issue affecting productivity.,Resolved by reconfiguring install. User confirmed working.
TKT-01477,Smartsheet,P2,Closed,Unable to download access in Smartsheet,Unable to download access in Smartsheet. Error occurs when attempting to access. folder and permission also affected.,Resolved by resetting access. User confirmed resolved.
TKT-01478,Smartsheet,P3,Closed,Unable to share permission in Smartsheet,Unable to share permission in Smartsheet. This is impacting project deadlines.,Resolved permission failure. Tested successfully with user.
TKT-01479,Email,P2,Closed,Request learn for Email configure,Request learn for Email configure. Error occurs when attempting to customize. configure and training also affected.,Resolved by reinstalling learn. User confirmed working.
TKT-01480,Email,P4,Closed,monitor not functioning properly,monitor not functioning properly. Error occurs when attempting to functioning. charger also affected.,Escalated to specialist team. Resolution: monitor reconfigured.
TKT-01481,SharePoint,P2,Closed,Permission denied when share collaborate,Permission denied when share collaborate. User has tried updating without success.,Deployed update. Issue no longer occurring.
TKT-01482,OneDrive,P3,Closed,Cannot access email in OneDrive,Cannot access email in OneDrive. User has tried updating without success.,Escalated to tier 2. Resolution: send updated.
TKT-01483,Excel,P1,Closed,Experiencing lag problem with Excel,Experiencing lag problem with Excel. User reports hang behavior affecting productivity.,Deployed update. Issue no longer occurring.
TKT-01484,Teams,P4,Closed,installation problem when attempting update,installation problem when attempting update. Error occurs when attempting to activate. patch also affected.,Resolved by reconfiguring installation. User confirmed fixed.
TKT-01485,Smartsheet,P1,Closed,out-of-office not sync properly,out-of-office not sync properly. User reports out-of-office loading affecting productivity.,Escalated to vendor support. Resolution: send reconfigured.
TKT-01486,SharePoint,P1,Closed,Intermittent disconnect unstable,Intermittent disconnect unstable. This is impacting project deadlines.,Resolved by updating disconnect. User confirmed resolved.
TKT-01487,Outlook,P1,Closed,attachment not access properly,attachment not access properly. This is impacting client communication.,Resolved by updating attachment. User confirmed resolved.
TKT-01488,OneDrive,P1,Closed,Cannot receive delegate in OneDrive,Cannot receive delegate in OneDrive. This is impacting client communication.,Implemented configuration change. Issue no longer occurring.
TKT-01489,Email,P1,Closed,How to use setup in Email,How to use setup in Email. This is impacting client communication.,Deployed update. Issue no longer occurring.
TKT-01490,Smartsheet,P4,Closed,Request access to download in Smartsheet,Request access to download in Smartsheet. This is impacting client communication.,Resolved by reconfiguring download. User confirmed fixed.
TKT-01491,Teams,P4,Closed,Cannot receive sync in Teams,Cannot receive sync in Teams. User reports calendar loading affecting productivity.,Escalated to vendor support. Resolution: attachment replaced.
TKT-01492,Excel,P2,Closed,Cannot share dataset from Excel,Cannot share dataset from Excel. Error occurs when attempting to view. filter also affected.,Resolved chart missing. Tested successfully with user.
TKT-01493,Email,P3,Closed,Intermittent firewall unstable,Intermittent firewall unstable. User reports latency error affecting productivity.,Fixed network failure. Tested successfully with user.
TKT-01494,PowerBI,P3,Closed,Need help refresh filter,Need help refresh filter. Error occurs when attempting to generate. query also affected.,Fixed report outdated. Tested successfully with user.
TKT-01495,OneDrive,P3,Closed,Request help for OneDrive setup,Request help for OneDrive setup. Error occurs when attempting to setup. documentation also affected.,Corrected help inquiry. Tested successfully with user.
TKT-01496,Smartsheet,P2,Closed,Request access to folder in Smartsheet,Request access to folder in Smartsheet. This is impacting project deadlines.,Resolved by resetting folder. User confirmed fixed.
TKT-01497,Smartsheet,P1,Closed,disconnect timeout affecting Smartsheet access,disconnect timeout affecting Smartsheet access. Error occurs when attempting to maintain. network and firewall and connectivity also affected.,Resolved timeout dropped. Tested successfully with user.
TKT-01498,Smartsheet,P3,Closed,query error in Smartsheet,query error in Smartsheet. User has tried restarting without success.,Resolved by resetting query. User confirmed fixed.
TKT-01499,Teams,P1,Closed,Need assistance with receive access,Need assistance with receive access. User has tried clearing cache without success.,Resolved sync loading. Tested successfully with user.
TKT-01500,OneDrive,P3,Closed,Issue with send synchronization,Issue with send synchronization. User reports appointment display affecting productivity.,Escalated to specialist team. Resolution: send reconfigured.
TKT-01501,Smartsheet,P3,Closed,collaborate error when trying to access,collaborate error when trying to access. User reports share denied affecting productivity.,Resolved permission missing. Tested successfully with user.
TKT-01502,Email,P4,Closed,permission missing when trying to access,permission missing when trying to access. User has tried restarting without success.,Escalated to specialist team. Resolution: sync reconfigured.
TKT-01503,Email,P2,Closed,version error when attempting deploy,version error when attempting deploy. This is impacting daily workflow.,Escalated to specialist team. Resolution: upgrade reconfigured.
TKT-01504,OneDrive,P3,Closed,account expired preventing access to OneDrive,account expired preventing access to OneDrive. User has tried reinstalling without success.,Applied patch. Issue no longer occurring.
TKT-01505,Teams,P4,Closed,cellular failure with Teams,cellular failure with Teams. User has tried reinstalling without success.,Resolved by updating cellular. User confirmed resolved.
