ticket_id,product,priority,status,short_description,description,closed_notes
TKT-01006,OneDrive,P4,Closed,Cannot connect due to timeout failure,Cannot connect due to timeout failure. Error occurs when attempting to establish. network and connection and disconnect also affected.,Escalated to specialist team. Resolution: firewall updated.
TKT-01007,Excel,P4,Closed,Unable to access download in Excel,Unable to access download in Excel. User reports file denied affecting productivity.,Resolved by updating download. User confirmed fixed.
TKT-01008,Teams,P1,Closed,How to setup instruction in Teams,How to setup instruction in Teams. Error occurs when attempting to manage. documentation and learn also affected.,Deployed configuration change. Issue no longer occurring.
TKT-01009,Teams,P2,Closed,access missing when trying to access,access missing when trying to access. User has tried reinstalling without success.,Escalated to specialist team. Resolution: collaborate reconfigured.
TKT-01010,Outlook,P2,Closed,monitor defective preventing work,monitor defective preventing work. User has tried updating without success.,Escalated to specialist team. Resolution: charger reconfigured.
TKT-01011,SharePoint,P3,Closed,SharePoint delay and problem,SharePoint delay and problem. Error occurs when attempting to typing. crash and lag also affected.,Applied configuration change. Issue no longer occurring.
TKT-01012,Outlook,P4,Closed,Issue with receive loading,Issue with receive loading. User has tried reinstalling without success.,Resolved sync display. Tested successfully with user.
TKT-01013,Teams,P2,Closed,Intermittent bandwidth error,Intermittent bandwidth error. User reports connection error affecting productivity.,Applied update. Issue no longer occurring.
TKT-01014,Outlook,P2,Closed,app problem with Outlook,app problem with Outlook. This is impacting daily workflow.,Resolved by updating app. User confirmed resolved.
TKT-01015,Smartsheet,P3,Closed,data incomplete in Smartsheet,data incomplete in Smartsheet. This is impacting team collaboration.,Resolved by updating data. User confirmed fixed.
TKT-01016,Teams,P4,Closed,Teams not update on remote,Teams not update on remote. This is impacting client communication.,Resolved by reinstalling remote. User confirmed fixed.
TKT-01017,Outlook,P1,Closed,collaborate error when trying to edit,collaborate error when trying to edit. This is impacting team collaboration.,Escalated to vendor support. Resolution: denied updated.
TKT-01018,Smartsheet,P2,Closed,Request to login two-factor for user account,Request to login two-factor for user account. User has tried updating without success.,Escalated to vendor support. Resolution: account updated.
TKT-01019,Excel,P1,Closed,User unable to login due to failure account,User unable to login due to failure account. User reports reset locked affecting productivity.,Resolved by updating account. User confirmed fixed.
TKT-01020,Teams,P3,Closed,receive not receive properly,receive not receive properly. User reports email display affecting productivity.,Fixed email synchronization. Tested successfully with user.
TKT-01021,Outlook,P2,Closed,Need help with unlock locked,Need help with unlock locked. User has tried clearing cache without success.,Applied update. Issue no longer occurring.
TKT-01022,PowerBI,P2,Closed,Permission denied when download document,Permission denied when download document. User has tried updating without success.,Fixed download denied. Tested successfully with user.
TKT-01023,OneDrive,P3,Closed,Need assistance with delegate access,Need assistance with delegate access. User reports appointment synchronization affecting productivity.,Deployed update. Issue no longer occurring.
TKT-01024,Teams,P3,Closed,monitor malfunction preventing work,monitor malfunction preventing work. User has tried restarting without success.,Resolved by resetting monitor. User confirmed working.
TKT-01025,Smartsheet,P2,Closed,attachment not sync properly,attachment not sync properly. User has tried reinstalling without success.,Resolved by reinstalling attachment. User confirmed working.
TKT-01026,OneDrive,P4,Closed,attachment not sync properly,attachment not sync properly. User reports out-of-office loading affecting productivity.,Escalated to vendor support. Resolution: inbox updated.
TKT-01027,Outlook,P4,Closed,Permission denied when delete collaborate,Permission denied when delete collaborate. User has tried clearing cache without success.,Deployed patch. Issue no longer occurring.
TKT-01028,SharePoint,P4,Closed,Issue with out-of-office display,Issue with out-of-office display. This is impacting team collaboration.,Resolved delegate synchronization. Tested successfully with user.
TKT-01029,Smartsheet,P1,Closed,Need training on how to manage in Smartsheet,Need training on how to manage in Smartsheet. Error occurs when attempting to customize. instruction and documentation also affected.,Resolved by resetting training. User confirmed working.
TKT-01030,Email,P2,Closed,Cannot send send in Email,Cannot send send in Email. User has tried clearing cache without success.,Resolved by reconfiguring send. User confirmed resolved.
TKT-01031,Teams,P3,Closed,Cannot send sync in Teams,Cannot send sync in Teams. User reports delegate loading affecting productivity.,Applied fix. Issue no longer occurring.
TKT-01032,OneDrive,P4,Closed,issue during license process,issue during license process. Error occurs when attempting to deploy.  also affected.,Fixed patch failure. Tested successfully with user.
TKT-01033,Excel,P3,Closed,send not send properly,send not send properly. User has tried clearing cache without success.,Resolved calendar synchronization. Tested successfully with user.
TKT-01034,Email,P3,Closed,Need assistance with email access,Need assistance with email access. User has tried restarting without success.,Deployed fix. Issue no longer occurring.
TKT-01035,OneDrive,P2,Closed,Request access to folder in OneDrive,Request access to folder in OneDrive. User reports document failure affecting productivity.,Resolved share missing. Tested successfully with user.
TKT-01036,Smartsheet,P2,Closed,Request application upgrade assistance,Request application upgrade assistance. Error occurs when attempting to configure. install and version also affected.,Resolved by reinstalling application. User confirmed fixed.
TKT-01037,SharePoint,P2,Closed,Cannot access appointment in SharePoint,Cannot access appointment in SharePoint. This is impacting client communication.,Implemented configuration change. Issue no longer occurring.
TKT-01038,Smartsheet,P1,Closed,Cannot connect due to VPN error,Cannot connect due to VPN error. Error occurs when attempting to establish. firewall and bandwidth also affected.,Escalated to vendor support. Resolution: connection updated.
TKT-01039,Email,P2,Closed,Request to login login for user account,Request to login login for user account. This is impacting project deadlines.,Resolved by reconfiguring login. User confirmed resolved.
TKT-01040,Email,P3,Closed,firewall timeout affecting Email access,firewall timeout affecting Email access. User reports offline unstable affecting productivity.,Resolved by updating firewall. User confirmed resolved.
TKT-01041,OneDrive,P3,Closed,Intermittent connection error,Intermittent connection error. Error occurs when attempting to establish. connectivity also affected.,Resolved by updating connection. User confirmed working.
TKT-01042,Outlook,P2,Closed,offline incompatibility with Outlook,offline incompatibility with Outlook. User has tried restarting without success.,Fixed cellular crash. Tested successfully with user.
TKT-01043,Excel,P3,Closed,Need help with reset error,Need help with reset error. This is impacting daily workflow.,Fixed account error. Tested successfully with user.
TKT-01044,Outlook,P3,Closed,Request application upgrade assistance,Request application upgrade assistance. User has tried restarting without success.,Fixed application error. Tested successfully with user.
TKT-01045,PowerBI,P2,Closed,Request to reset account for user account,Request to reset account for user account. Error occurs when attempting to authenticate. locked and reset also affected.,Deployed update. Issue no longer occurring.
TKT-01046,Excel,P1,Closed,Permission denied when delete denied,Permission denied when delete denied. This is impacting team collaboration.,Resolved by reconfiguring denied. User confirmed working.
TKT-01047,SharePoint,P4,Closed,credential problem preventing access to SharePoint,credential problem preventing access to SharePoint. User reports reset expired affecting productivity.,Resolved by reconfiguring credential. User confirmed resolved.
TKT-01048,Email,P1,Closed,Email timeout when loading,Email timeout when loading. User reports timeout behavior affecting productivity.,Resolved by reconfiguring timeout. User confirmed resolved.
TKT-01049,SharePoint,P4,Closed,SharePoint performance when saving,SharePoint performance when saving. User reports crash issue affecting productivity.,Resolved by reinstalling performance. User confirmed resolved.
TKT-01050,Excel,P1,Closed,export not create correctly,export not create correctly. User has tried updating without success.,Resolved by reinstalling export. User confirmed resolved.
TKT-01051,SharePoint,P3,Closed,Experiencing loading performance with SharePoint,Experiencing loading performance with SharePoint. User reports performance behavior affecting productivity.,Escalated to specialist team. Resolution: hang replaced.
TKT-01052,Smartsheet,P3,Closed,Cannot send sync in Smartsheet,Cannot send sync in Smartsheet. Error occurs when attempting to view. receive and send and inbox also affected.,Applied patch. Issue no longer occurring.
TKT-01053,Email,P3,Closed,two-factor issue preventing access to Email,two-factor issue preventing access to Email. User reports locked locked affecting productivity.,Deployed patch. Issue no longer occurring.
TKT-01054,PowerBI,P1,Closed,authentication problem preventing access to PowerBI,authentication problem preventing access to PowerBI. User reports expired expired affecting productivity.,Resolved MFA expired. Tested successfully with user.
TKT-01055,Email,P2,Closed,Issue with send synchronization,Issue with send synchronization. This is impacting team collaboration.,Implemented configuration change. Issue no longer occurring.
TKT-01056,Email,P4,Closed,Issue with receive synchronization,Issue with receive synchronization. User has tried updating without success.,Resolved appointment synchronization. Tested successfully with user.
TKT-01057,SharePoint,P4,Closed,connectivity error affecting SharePoint access,connectivity error affecting SharePoint access. This is impacting client communication.,Fixed firewall blocked. Tested successfully with user.
TKT-01058,Outlook,P4,Closed,Outlook crash when typing,Outlook crash when typing. Error occurs when attempting to scrolling. delay and freeze also affected.,Escalated to specialist team. Resolution: loading replaced.
TKT-01059,OneDrive,P2,Closed,Issue with delegate delivery,Issue with delegate delivery. User has tried restarting without success.,Resolved send delivery. Tested successfully with user.
TKT-01060,SharePoint,P3,Closed,filter incomplete in SharePoint,filter incomplete in SharePoint. User has tried restarting without success.,Deployed update. Issue no longer occurring.
TKT-01061,Smartsheet,P3,Closed,Permission denied when upload access,Permission denied when upload access. User reports denied missing affecting productivity.,Corrected access failure. Tested successfully with user.
TKT-01062,Email,P1,Closed,compatibility during activation process,compatibility during activation process. User has tried reinstalling without success.,Implemented patch. Issue no longer occurring.
TKT-01063,OneDrive,P1,Closed,OneDrive loading and issue,OneDrive loading and issue. This is impacting daily workflow.,Resolved by reconfiguring loading. User confirmed fixed.
TKT-01064,Excel,P3,Closed,Request license upgrade assistance,Request license upgrade assistance. User has tried clearing cache without success.,Fixed installation failure. Tested successfully with user.
TKT-01065,Email,P3,Closed,upload denied when trying to access,upload denied when trying to access. This is impacting client communication.,Fixed collaborate corrupted. Tested successfully with user.
TKT-01066,Outlook,P3,Closed,Cannot send attachment in Outlook,Cannot send attachment in Outlook. User has tried restarting without success.,Resolved by resetting attachment. User confirmed working.
TKT-01067,Teams,P4,Closed,Request to authenticate credential for user account,Request to authenticate credential for user account. This is impacting daily workflow.,Resolved by updating credential. User confirmed working.
TKT-01068,Smartsheet,P1,Closed,Unable to delete document in Smartsheet,Unable to delete document in Smartsheet. This is impacting daily workflow.,Fixed upload error. Tested successfully with user.
TKT-01069,Smartsheet,P2,Closed,upload missing when trying to upload,upload missing when trying to upload. User has tried updating without success.,Resolved by reinstalling upload. User confirmed resolved.
TKT-01070,Smartsheet,P3,Closed,Cannot send sync in Smartsheet,Cannot send sync in Smartsheet. This is impacting daily workflow.,Implemented configuration change. Issue no longer occurring.
TKT-01071,OneDrive,P3,Closed,User unable to reset due to error expired,User unable to reset due to error expired. This is impacting team collaboration.,Corrected reset error. Tested successfully with user.
TKT-01072,Smartsheet,P4,Closed,Smartsheet timeout and issue,Smartsheet timeout and issue. Error occurs when attempting to typing. delay and slow also affected.,Resolved by resetting timeout. User confirmed working.
TKT-01073,OneDrive,P4,Closed,report incorrect in OneDrive,report incorrect in OneDrive. This is impacting project deadlines.,Escalated to tier 2. Resolution: visualization reconfigured.
TKT-01074,OneDrive,P3,Closed,Application delay during normal use,Application delay during normal use. This is impacting team collaboration.,Applied update. Issue no longer occurring.
TKT-01075,Smartsheet,P2,Closed,Permission denied when delete permission,Permission denied when delete permission. User has tried reinstalling without success.,Deployed fix. Issue no longer occurring.
TKT-01076,Smartsheet,P4,Closed,report incomplete in Smartsheet,report incomplete in Smartsheet. Error occurs when attempting to generate. filter also affected.,Escalated to tier 2. Resolution: data replaced.
TKT-01077,Excel,P3,Closed,Permission denied when edit document,Permission denied when edit document. User has tried reinstalling without success.,Resolved by resetting document. User confirmed working.
TKT-01078,Smartsheet,P3,Closed,Request to unlock account for user account,Request to unlock account for user account. User reports account expired affecting productivity.,Escalated to specialist team. Resolution: unlock updated.
TKT-01079,Teams,P3,Closed,Need replacement hardware,Need replacement hardware. Error occurs when attempting to displaying. charger also affected.,Implemented configuration change. Issue no longer occurring.
TKT-01080,Smartsheet,P2,Closed,dashboard error in Smartsheet,dashboard error in Smartsheet. Error occurs when attempting to update. dataset and chart and export also affected.,Resolved filter missing. Tested successfully with user.
TKT-01081,Teams,P4,Closed,Request access to share in Teams,Request access to share in Teams. Error occurs when attempting to upload. access and download also affected.,Corrected file corrupted. Tested successfully with user.
TKT-01082,Excel,P1,Closed,smartphone failure with Excel,smartphone failure with Excel. User reports Android crash affecting productivity.,Implemented configuration change. Issue no longer occurring.
TKT-01083,PowerBI,P1,Closed,Need to deploy activation for PowerBI,Need to deploy activation for PowerBI. User reports software problem affecting productivity.,Resolved by reinstalling activation. User confirmed fixed.
TKT-01084,OneDrive,P4,Closed,document failure when trying to share,document failure when trying to share. User reports sync denied affecting productivity.,Fixed download failure. Tested successfully with user.
TKT-01085,Smartsheet,P3,Closed,Issue with appointment synchronization,Issue with appointment synchronization. User reports email delivery affecting productivity.,Resolved by reinstalling appointment. User confirmed working.
TKT-01086,Outlook,P4,Closed,Seeking help for new Outlook feature,Seeking help for new Outlook feature. This is impacting project deadlines.,Deployed update. Issue no longer occurring.
TKT-01087,OneDrive,P3,Closed,Issue with email delivery,Issue with email delivery. User reports receive display affecting productivity.,Corrected attachment synchronization. Tested successfully with user.
TKT-01088,SharePoint,P2,Closed,Experiencing unresponsive performance with SharePoint,Experiencing unresponsive performance with SharePoint. Error occurs when attempting to saving. delay and slow also affected.,Resolved timeout behavior. Tested successfully with user.
TKT-01089,Outlook,P2,Closed,VPN blocked affecting Outlook access,VPN blocked affecting Outlook access. This is impacting team collaboration.,Resolved connection dropped. Tested successfully with user.
TKT-01090,Smartsheet,P3,Closed,User unable to reset due to expired authentication,User unable to reset due to expired authentication. User has tried restarting without success.,Fixed locked issue. Tested successfully with user.
TKT-01091,SharePoint,P1,Closed,Request license update assistance,Request license update assistance. Error occurs when attempting to update. version also affected.,Fixed patch error. Tested successfully with user.
TKT-01092,Outlook,P2,Closed,Permission denied when share collaborate,Permission denied when share collaborate. User reports folder corrupted affecting productivity.,Corrected download error. Tested successfully with user.
TKT-01093,Excel,P4,Closed,User unable to access due to error MFA,User unable to access due to error MFA. User has tried clearing cache without success.,Escalated to specialist team. Resolution: password replaced.
TKT-01094,Outlook,P1,Closed,access denied when trying to download,access denied when trying to download. Error occurs when attempting to move. file also affected.,Corrected upload denied. Tested successfully with user.
TKT-01095,Email,P3,Closed,version issue when attempting install,version issue when attempting install. Error occurs when attempting to configure. installation and update also affected.,Implemented fix. Issue no longer occurring.
TKT-01096,Outlook,P4,Closed,Application crash during normal use,Application crash during normal use. Error occurs when attempting to loading. hang and delay also affected.,Implemented configuration change. Issue no longer occurring.
TKT-01097,Email,P3,Closed,monitor defective requiring support,monitor defective requiring support. User reports device failure affecting productivity.,Corrected mouse failure. Tested successfully with user.
TKT-01098,OneDrive,P2,Closed,inbox not delete properly,inbox not delete properly. This is impacting daily workflow.,Resolved email delivery. Tested successfully with user.
TKT-01099,Excel,P4,Closed,Request access to document in Excel,Request access to document in Excel. User has tried clearing cache without success.,Deployed patch. Issue no longer occurring.
TKT-01100,SharePoint,P3,Closed,Cannot send calendar in SharePoint,Cannot send calendar in SharePoint. User reports attachment display affecting productivity.,Resolved by reinstalling calendar. User confirmed working.
TKT-01101,Smartsheet,P1,Closed,Permission denied when access collaborate,Permission denied when access collaborate. This is impacting client communication.,Resolved by reinstalling collaborate. User confirmed fixed.
TKT-01102,Excel,P1,Closed,Unable to upload download in Excel,Unable to upload download in Excel. This is impacting project deadlines.,Escalated to specialist team. Resolution: document replaced.
TKT-01103,Excel,P4,Closed,password error preventing access to Excel,password error preventing access to Excel. Error occurs when attempting to reset. reset and credential also affected.,Escalated to vendor support. Resolution: MFA updated.
TKT-01104,Email,P2,Closed,laptop failure preventing work,laptop failure preventing work. User has tried restarting without success.,Escalated to vendor support. Resolution: charger replaced.
TKT-01105,SharePoint,P4,Closed,Cannot view export from SharePoint,Cannot view export from SharePoint. User reports refresh error affecting productivity.,Deployed update. Issue no longer occurring.
TKT-01106,Email,P1,Closed,network unstable affecting Email access,network unstable affecting Email access. User has tried clearing cache without success.,Resolved by reinstalling network. User confirmed working.
TKT-01107,Email,P1,Closed,visualization missing in Email,visualization missing in Email. User has tried restarting without success.,Deployed fix. Issue no longer occurring.
TKT-01108,PowerBI,P1,Closed,two-factor expired preventing access to PowerBI,two-factor expired preventing access to PowerBI. User reports password locked affecting productivity.,Resolved by reinstalling two-factor. User confirmed fixed.
TKT-01109,Email,P3,Closed,Need assistance with appointment view,Need assistance with appointment view. User reports calendar display affecting productivity.,Resolved by resetting appointment. User confirmed fixed.
TKT-01110,Excel,P2,Closed,User unable to reset due to locked unlock,User unable to reset due to locked unlock. User reports login failure affecting productivity.,Corrected reset error. Tested successfully with user.
TKT-01111,Smartsheet,P1,Closed,Cannot connect due to network unstable,Cannot connect due to network unstable. Error occurs when attempting to establish. firewall and offline also affected.,Escalated to tier 2. Resolution: VPN replaced.
TKT-01112,Smartsheet,P2,Closed,dataset not refresh correctly,dataset not refresh correctly. This is impacting project deadlines.,Resolved filter error. Tested successfully with user.
TKT-01113,SharePoint,P3,Closed,Cannot connect due to bandwidth error,Cannot connect due to bandwidth error. This is impacting project deadlines.,Escalated to vendor support. Resolution: connection replaced.
TKT-01114,SharePoint,P2,Closed,Unable to access collaborate in SharePoint,Unable to access collaborate in SharePoint. This is impacting project deadlines.,Implemented patch. Issue no longer occurring.
TKT-01115,Teams,P3,Closed,Request to authenticate authentication for user account,Request to authenticate authentication for user account. User reports login expired affecting productivity.,Applied configuration change. Issue no longer occurring.
TKT-01116,SharePoint,P2,Closed,Request access to folder in SharePoint,Request access to folder in SharePoint. This is impacting project deadlines.,Implemented update. Issue no longer occurring.
TKT-01117,SharePoint,P1,Closed,SharePoint delay and performance,SharePoint delay and performance. Error occurs when attempting to searching. crash and hang also affected.,Applied update. Issue no longer occurring.
TKT-01118,Outlook,P2,Closed,User unable to unlock due to issue MFA,User unable to unlock due to issue MFA. User has tried clearing cache without success.,Implemented configuration change. Issue no longer occurring.
TKT-01119,PowerBI,P4,Closed,Unable to move folder in PowerBI,Unable to move folder in PowerBI. Error occurs when attempting to edit. download and denied and share also affected.,Escalated to vendor support. Resolution: permission reconfigured.
TKT-01120,Excel,P1,Closed,Excel unavailable due to latency problem,Excel unavailable due to latency problem. This is impacting project deadlines.,Resolved connectivity dropped. Tested successfully with user.
TKT-01121,PowerBI,P4,Closed,Need to upgrade license for PowerBI,Need to upgrade license for PowerBI. Error occurs when attempting to install. version also affected.,Escalated to specialist team. Resolution: patch updated.
TKT-01122,Teams,P1,Closed,Need assistance with send delete,Need assistance with send delete. Error occurs when attempting to sync. calendar and delegate also affected.,Implemented configuration change. Issue no longer occurring.
TKT-01123,Smartsheet,P4,Closed,Experiencing slow performance with Smartsheet,Experiencing slow performance with Smartsheet. User reports timeout issue affecting productivity.,Resolved by reconfiguring slow. User confirmed resolved.
TKT-01124,Smartsheet,P2,Closed,Smartsheet not open on Android,Smartsheet not open on Android. This is impacting team collaboration.,Escalated to tier 2. Resolution: offline updated.
TKT-01125,Smartsheet,P4,Closed,appointment not receive properly,appointment not receive properly. User reports email display affecting productivity.,Deployed update. Issue no longer occurring.
TKT-01126,PowerBI,P2,Closed,Need assistance with email receive,Need assistance with email receive. Error occurs when attempting to view. out-of-office also affected.,Resolved by updating email. User confirmed fixed.
TKT-01127,Smartsheet,P4,Closed,Smartsheet unresponsive when saving,Smartsheet unresponsive when saving. Error occurs when attempting to scrolling. freeze and slow also affected.,Applied patch. Issue no longer occurring.
TKT-01128,OneDrive,P4,Closed,timeout failure affecting OneDrive access,timeout failure affecting OneDrive access. User has tried clearing cache without success.,Resolved firewall failure. Tested successfully with user.
TKT-01129,OneDrive,P4,Closed,Cannot refresh dataset from OneDrive,Cannot refresh dataset from OneDrive. User has tried restarting without success.,Escalated to specialist team. Resolution: chart replaced.
